Contributrice,Langue,Auteur,Oeuvre,Référence,Prose/poésie,Nombre de mots,Coupes,Niveau,Titre du texte,Conj,Morphologie,Syntaxe,Texte latin/grec,Traduction,Crédit Traduction
Sarah Gaucher,Latin,Sénèque,Lettres à Lucilius,70,Prose,173,FAUX,4,Réflexions sur le suicide,"Indicatif parfait, Subjonctif plus-que-parfait, Infinitif présent, Indicatif imparfait, Subjonctif imparfait, Adjectif verbal, Participe présent, Gérondif, Déponent, Indicatif futur","Comparatif de l'adverbe, Superlatif, ""ille, illa, illud"", ""qui, quae, quod"", ""is, ea, id"", ""hic, haec, hoc""","Circonstancielle causale (subjonctif), Cum + subjonctif, Adjectif verbal épithète, Ablatif absolu, Complément du comparatif, Proposition relative (subjonctif), Exclamative, Système hypothétique (irréel du passé), Interrogative indirecte, Comparative (indicatif), Interrogative directe, Adjectif verbal attribut, Circonstancielle causale (indicatif), Circonstancielle finale (subjonctif), ""Proposition infinitive
"", Accusatif exclamatif, Subjonctif en principale","Vilissimae sortis homines ingenti impetu in tutum euaserunt, cumque e commodo mori non licuisset nec ad arbitrium suum instrumenta mortis eligere, obuia quaeque rapuerunt et quae natura non erant noxia ui sua tela fecerunt. Nuper in ludo bestiariorum unus e Germanis, cum ad matutina spectacula pararetur, secessit ad exonerandum corpus : nullum aliud illi dabatur sine custode secretum ; ibi lignum id quod ad emundanda obscena adhaerente spongia positum est totum in gulam farsit et interclusis faucibus spiritum elisit. Hoc fuit morti contumeliam facere. Ita prorsus, parum munde et parum decenter : quid est stultius quam fastidiose mori ? O uirum fortem, o dignum cui fati daretur electio ! Quam fortiter ille gladio usus esset, quam animose in profundam se altitudinem maris aut abscisae rupis immisisset ! Vndique destitutus inuenit quemadmodum et mortem sibi deberet et telum , ut scias ad moriendum nihil aliud in mora esse quam uelle. Existimetur de facto hominis acerrimi ut cuique uisum erit, dum hoc  constet, praeferendam esse spurcissimam mortem seruituti mundissimae. Quoniam coepi sordidis exemplis uti, perseuerabo.","Des hommes de la plus basse extraction, avec un effort immense, se refugièrent en lieu sûr et, puisqu’il ne leur avait pas été donné de mourir comme il leur convenait ni de choisir à leur guise les moyens de se donner la mort, ils se saisirent de tout ce qui put leur tomber sous la main et mirent leur énergie à faire d’objets qui, en soi, n’étaient pas dangereux des armes. Récemment, lors d’un jeu qui mettait aux prises les gladiateurs à des bêtes, un Germain, alors qu’on le préparait pour les combats du matin, se retira pour pour soulager son corps. On ne lui permettait d’aller dans aucun autre endroit qui fût à l’abri des regards d’un garde. Là, il s’enfonça complètement dans le gosier le bâton qui est y placé avec une éponge accrochée au bout pour nettoyer les excréments et il rendit l’âme, la gorge obstruée. Cette attitude revint à faire un affront à la mort. Oui, tout à fait : de façon bien peu propre et bien peu décente. Mais qu’y aurait-il  de plus stupide que de mourir en jouant les délicats ? Ô homme courageux, ô homme qui méritait qu’on lui donnât le choix de son destin ! Avec quel courage cet homme aurait manié l’épée, avec quelle hardiesse il se serait précipité dans un gouffre profond en mer ou au fond d’un ravin, à flanc d’un rocher abrupt ! Abandonné de toutes parts, il trouva le moyen de ne se devoir qu’à lui-même tant la mort que son arme, pour qu’on sache que, pour mourir, rien d’autre ne nous retarde que notre volonté. Que chacun apprécie l’acte de cet homme si impétueux comme bon lui semblera, pourvu que l’on tienne pour avéré qu’il faut préférer la mort la plus immonde à la servitude la plus propre. Puisque j’ai commencé à prendre des exemples triviaux, je vais continuer dans cette voie.",Sarah Gaucher
Sarah Gaucher,Latin,Ovide,Héroïdes,1.47-74,Poésie,205,FAUX,4,Pénélope déplore l'absence d'Ulysse,"Indicatif présent, Participe parfait, Indicatif parfait, Indicatif imparfait, Participe présent, Adjectif verbal, Infinitif présent, Gérondif, Subjonctif parfait, Subjonctif imparfait, Subjonctif présent, Déponent","""qui, quae, quod"", ""ille, illa, illud"", ""hic, haec, hoc"", Comparatif de l'adverbe, ""quis, quae, quid""","Interrogative directe, Système hypothétique (réel), Adjectif verbal attribut, Interrogative indirecte, Subjonctif en principale, Comparative (indicatif), Ablatif absolu, Proposition relative (indicatif), Circonstancielle de lieu (ubi), Omission du verbe esse","Sed mihi quid prodest uestris disiecta lacertis
Ilios, et murus quod fuit esse solum,
si maneo qualis Troia durante manebam
uirque mihi dempto fine carendus abest ?
Diruta sunt aliis, uni mihi Pergama restant, 
incola captiuo quae boue uictor arat.
Iam seges est ubi Troia fuit resecandaque falce
luxuriat Phrygio sanguine pinguis humus ;
semisepulta uirum  curuis feriuntur aratris
ossa ; ruinosas occulit herba domos.
Victor abes nec scire mihi quae causa morandi
aut in quo lateas, ferreus, orbe licet !
Quisquis ad haec uertit peregrinam litora puppim,
ille mihi  de te multa rogatus abit,
quamque tibi reddat, si te modo uiderit usquam,
traditur huic digitis charta notata meis.
Nos Pylon , antiqui Neleia Nestoris arua,
misimus ; incerta est fama remissa Pylo.
Misimus et Sparten ; Sparte quoque nescia ueri.
Quas habitas terras aut ubi lentus abes ?
Vtilius starent etiamnunc moenia Phoebi
(irascor uotis, heu !, leuis ipsa meis).
Scirem ubi pugnares et tantum bella timerem,
et mea cum multis iuncta querela foret. // (arrêt possible)
Quid timeam, ignoro ¬ timeo tamen omnia demens,
et patet in curas area lata meas.
Quaecumque aequor habet, quaecumque pericula tellus,
tam longae causas suspicor esse morae.
Haec ego dum stulte metuo, quae  uestra libido est,
esse peregrino captus amore potes.","Mais à quoi me sert qu’Ilion ait été renversée par vos bras et que son ancienne muraille soit au niveau du sol si je demeure telle que je demeurais lorsque Troie perdurait, si l’absence du mari dont je suis privée ne doit point avoir de termes ? Détruite pour les autres, pour moi seule Pergame est encore debout, elle que le vainqueur qui y séjourne laboure avec un bœuf captif. Déjà la moisson se tient où se tint Troie et la terre, engraissée du sang phrygien, offre son abondante récolte au tranchant de la faux ; le soc recourbé heurte les ossements à demi ensevelis des guerriers ; l’herbe couvre les maisons en ruine. Vainqueur, tu es absent et je ne puis savoir ni la cause de ton retard ni en quelle partie du monde tu te caches, insensible ! Quiconque dirige vers ces rivages sa poupe étrangère ne s’en va qu’après que je l’ai pressé de nombreuses questions à ton propos et on lui confie une lettre écrite de mes mains pour qu’il te la remette, si toutefois il t’a rencontré quelque part. Nous avons envoyé un émissaire à Pylos, pays du vieux Nestor, fils de Nélée. Les nouvelles rapportées de Pylos sont incertaines. Nous avons également envoyé un émissaire à Sparte ; Sparte aussi ignore la vérité. Quelles terres habites-tu et en quel lieu t’attardes-tu ? Je gagnerais davantage à ce que les remparts de Phébus se tiennent encore débout (hélas ! inconséquente que je suis, je m’irrite contre mes propres vœux !). Je saurais où tu combats, je ne craindrais que la guerre et ma plainte serait jointe à beaucoup d’autres. Je ne sais ce que je crains. Cependant, dans mon égarement, je crains tout et un vaste champ est ouvert à mes inquiétudes. Tous les périls que recèle la mer, tous ceux que recèle la terre, je les soupçonne d'être la cause de si longs retards. Tandis que pour ma part je ressasse sottement ces craintes, tu es peut-être captif d’un amour étranger (tel est votre désir, à vous les hommes !).",Sarah Gaucher
